{
  "schema_version": 1,
  "chapter": "v01_c001",
  "generated_at": "2026-05-20T17:04:21+00:00",
  "status": "BLOCKED",
  "official_chapter": {
    "path": "chapters/v01/c001.md",
    "sha256": ""
  },
  "summary": {
    "dialogue_line_count": 0,
    "sample_count": 0,
    "pure_theme_statement_count": 0,
    "pure_theme_statement_ratio": 0.0
  },
  "samples": [],
  "blockers": [
    "migration draft is not reviewed"
  ],
  "warnings": [],
  "human_acceptance": null
}
